Information for device RAFI Glasscape Touch (VID=0x05BD PID=0x3104):

------------------------------
Connection Information:
------------------------------
Device current bus speed: FullSpeed
Device supports USB 1.1 specification
Device supports USB 2.0 specification
Device address: 0x001D
Current configuration value: 0x00
Number of open pipes: 0


------------------------------
Device Descriptor:
------------------------------
0x12	bLength
0x01	bDescriptorType
0x0200	bcdUSB
0x00	bDeviceClass      
0x00	bDeviceSubClass   
0x00	bDeviceProtocol   
0x40	bMaxPacketSize0   (64 bytes)
0x05BD	idVendor
0x3104	idProduct
0x0200	bcdDevice
0x01	iManufacturer   "RAFI GmbH & Co. KG"
0x02	iProduct        "RAFI Glasscape Touch"
0x03	iSerialNumber   "2082314E4E48"
0x01	bNumConfigurations


-------------------------
Configuration Descriptor:
-------------------------
0x09	bLength
0x02	bDescriptorType
0x0029	wTotalLength   (41 bytes)
0x01	bNumInterfaces
0x01	bConfigurationValue
0x04	iConfiguration   "Custom HID Config"
0x80	bmAttributes   (Bus-powered Device)
0x32	bMaxPower      (100 mA)

Interface Descriptor:
------------------------------
0x09	bLength
0x04	bDescriptorType
0x00	bInterfaceNumber
0x00	bAlternateSetting
0x02	bNumEndPoints
0x03	bInterfaceClass      (Human Interface Device Class)
0x00	bInterfaceSubClass   
0x00	bInterfaceProtocol   
0x00	iInterface

HID Descriptor:
------------------------------
0x09	bLength
0x21	bDescriptorType
0x0111	bcdHID
0x00	bCountryCode
0x01	bNumDescriptors
0x22	bDescriptorType   (Report descriptor)
0x02CC	bDescriptorLength

Endpoint Descriptor:
------------------------------
0x07	bLength
0x05	bDescriptorType
0x83	bEndpointAddress  (IN endpoint 3)
0x03	bmAttributes      (Transfer: Interrupt / Synch: None / Usage: Data)
0x0040	wMaxPacketSize    (1 x 64 bytes)
0x01	bInterval         (1 frames)

Endpoint Descriptor:
------------------------------
0x07	bLength
0x05	bDescriptorType
0x03	bEndpointAddress  (OUT endpoint 3)
0x03	bmAttributes      (Transfer: Interrupt / Synch: None / Usage: Data)
0x0040	wMaxPacketSize    (1 x 64 bytes)
0x01	bInterval         (1 frames)

Microsoft OS Descriptor is not available. Error code: 0x0000001F


--------------------------------
String Descriptor Table
--------------------------------
Index  LANGID  String
0x00   0x0000  0x0409 
0x01   0x0409  "RAFI GmbH & Co. KG"
0x02   0x0409  "RAFI Glasscape Touch"
0x03   0x0409  "2082314E4E48"
0x04   0x0409  "Custom HID Config"

------------------------------

Connection path for device: 
USB-xHCI-kompatibler Hostcontroller
Root Hub
Generischer USB-Hub
Generischer USB-Hub
Generischer USB-Hub
RAFI Glasscape Touch (VID=0x05BD PID=0x3104) Port: 2

Running on: Windows 10 or greater (Build Version 19045)

Brought to you by TDD v2.17.0, Feb 23 2021, 14:04:02
