002:046:001:DESCRIPTOR         1691567241.231130
 06 00 FF 09 01 A1 01 15 00 26 FF 00 75 08 95 3F
 85 0A 09 01 81 02 09 01 91 02 85 0B 09 01 81 02
 09 01 91 02 85 0C 09 01 81 02 09 01 91 02 85 0D
 09 01 81 02 09 01 91 02 85 0E 09 01 81 02 09 01
 91 02 85 0F 09 01 81 02 09 01 91 02 85 10 09 01
 81 02 09 01 91 02 85 11 09 01 81 02 09 01 91 02
 85 12 09 01 81 02 09 01 91 02 85 14 09 01 81 02
 09 01 91 02 85 15 09 01 81 02 09 01 91 02 85 16
 09 01 81 02 09 01 91 02 85 17 09 01 81 02 09 01
 91 02 85 18 09 01 81 02 09 01 91 02 85 19 09 01
 91 02 85 1A 09 01 91 02 85 1B 09 01 91 02 85 1C
 09 01 91 02 85 1D 09 01 91 02 85 1E 09 01 91 02
 85 28 09 01 81 02 09 01 91 02 85 29 09 01 81 02
 09 01 91 02 85 2A 09 01 81 02 09 01 91 02 85 2B
 09 01 91 02 85 2C 09 01 91 02 85 32 09 01 91 02
 85 3C 09 01 91 02 85 3D 09 01 91 02 85 3E 09 01
 91 02 85 3F 09 01 91 02 85 46 09 01 81 02 09 01
 91 02 85 47 09 01 81 02 09 01 91 02 85 48 09 01
 81 02 09 01 91 02 85 49 09 01 81 02 09 01 91 02
 85 4A 09 01 81 02 09 01 91 02 85 4B 09 01 81 02
 09 01 91 02 85 4C 09 01 81 02 09 01 91 02 85 4D
 09 01 81 02 09 01 91 02 85 4E 09 01 81 02 09 01
 91 02 85 4F 09 01 81 02 09 01 91 02 85 50 09 01
 81 02 09 01 91 02 85 51 09 01 81 02 09 01 91 02
 85 52 09 01 81 02 09 01 91 02 85 53 09 01 81 02
 09 01 91 02 85 54 09 01 81 02 09 01 91 02 85 55
 09 01 81 02 09 01 91 02 85 56 09 01 81 02 09 01
 91 02 85 57 09 01 81 02 09 01 91 02 85 58 09 01
 81 02 09 01 91 02 85 59 09 01 81 02 09 01 91 02
 85 5A 09 01 81 02 09 01 91 02 85 5B 09 01 81 02
 09 01 91 02 85 5C 09 01 81 02 09 01 91 02 85 5D
 09 01 81 02 09 01 91 02 85 5E 09 01 81 02 09 01
 91 02 85 5F 09 01 81 02 09 01 91 02 85 60 09 01
 81 02 09 01 91 02 85 61 09 01 81 02 09 01 91 02
 85 62 09 01 81 02 09 01 91 02 85 63 09 01 81 02
 09 01 91 02 85 64 09 01 81 02 09 01 91 02 85 65
 09 01 81 02 09 01 91 02 C0

002:046:000:DESCRIPTOR         1691567241.235911
 05 0D 09 04 A1 01 85 01 65 11 55 0F 05 0D 09 22
 A1 02 09 42 15 00 25 01 75 01 95 01 81 02 81 03
 09 47 81 02 95 05 81 03 75 08 09 51 25 09 95 01
 81 02 05 01 46 90 01 26 7F 07 35 00 75 10 09 30
 81 02 46 13 01 26 37 04 09 31 81 02 C0 05 0D 09
 22 A1 02 09 42 15 00 25 01 75 01 95 01 81 02 81
 03 09 47 81 02 95 05 81 03 75 08 09 51 25 09 95
 01 81 02 05 01 46 90 01 26 7F 07 35 00 75 10 09
 30 81 02 46 13 01 26 37 04 09 31 81 02 C0 05 0D
 09 22 A1 02 09 42 15 00 25 01 75 01 95 01 81 02
 81 03 09 47 81 02 95 05 81 03 75 08 09 51 25 09
 95 01 81 02 05 01 46 90 01 26 7F 07 35 00 75 10
 09 30 81 02 46 13 01 26 37 04 09 31 81 02 C0 05
 0D 09 22 A1 02 09 42 15 00 25 01 75 01 95 01 81
 02 81 03 09 47 81 02 95 05 81 03 75 08 09 51 25
 09 95 01 81 02 05 01 46 90 01 26 7F 07 35 00 75
 10 09 30 81 02 46 13 01 26 37 04 09 31 81 02 C0
 05 0D 09 22 A1 02 09 42 15 00 25 01 75 01 95 01
 81 02 81 03 09 47 81 02 95 05 81 03 75 08 09 51
 25 09 95 01 81 02 05 01 46 90 01 26 7F 07 35 00
 75 10 09 30 81 02 46 13 01 26 37 04 09 31 81 02
 C0 05 0D 09 22 A1 02 09 42 15 00 25 01 75 01 95
 01 81 02 81 03 09 47 81 02 95 05 81 03 75 08 09
 51 25 09 95 01 81 02 05 01 46 90 01 26 7F 07 35
 00 75 10 09 30 81 02 46 13 01 26 37 04 09 31 81
 02 C0 05 0D 09 22 A1 02 09 42 15 00 25 01 75 01
 95 01 81 02 81 03 09 47 81 02 95 05 81 03 75 08
 09 51 25 09 95 01 81 02 05 01 46 90 01 26 7F 07
 35 00 75 10 09 30 81 02 46 13 01 26 37 04 09 31
 81 02 C0 05 0D 09 22 A1 02 09 42 15 00 25 01 75
 01 95 01 81 02 81 03 09 47 81 02 95 05 81 03 75
 08 09 51 25 09 95 01 81 02 05 01 46 90 01 26 7F
 07 35 00 75 10 09 30 81 02 46 13 01 26 37 04 09
 31 81 02 C0 05 0D 09 22 A1 02 09 42 15 00 25 01
 75 01 95 01 81 02 81 03 09 47 81 02 95 05 81 03
 75 08 09 51 25 09 95 01 81 02 05 01 46 90 01 26
 7F 07 35 00 75 10 09 30 81 02 46 13 01 26 37 04
 09 31 81 02 C0 05 0D 09 22 A1 02 09 42 15 00 25
 01 75 01 95 01 81 02 81 03 09 47 81 02 95 05 81
 03 75 08 09 51 25 09 95 01 81 02 05 01 46 90 01
 26 7F 07 35 00 75 10 09 30 81 02 46 13 01 26 37
 04 09 31 81 02 C0 05 0D 09 54 95 01 75 08 15 00
 25 09 81 02 05 0D 55 0C 66 01 10 47 FF FF 00 00
 27 FF FF 00 00 75 10 95 01 09 56 81 02 05 0D 85
 02 95 01 75 08 09 55 25 0A B1 02 C0

